店名,住所,台数
ビックカメラ あべのキューズモール店,大阪府阿倍野区阿倍野筋1-6-1 あべのキューズモール内3階,1台
イトーヨーカドー　アリオ内八尾店,大阪府八尾市光町２－３ アリオ八尾,2台
レインボーランド八尾店,大阪府八尾市沼１丁目１番地 イズミヤ八尾１階,1台
エンターテイメントフィールド ららぽーとEXPOCITY店,大阪府吹田市千里万博公園２－１ ららぽーとＥＸＰＯＣＩＴＹ３Ｆ,1台
トイザらス阪急山田店,大阪府吹田市山田西４－１－２ デュー阪急山田４Ｆ,1台
モーリーファンタジー南千里店,大阪府吹田市千里山西６－５６－１ イオン南千里４階,2台
モーリーファンタジー吹田店,大阪府吹田市朝日町2番101号 ダイエー吹田4F,2台
レインボーランド千里丘店,大阪府吹田市山田南１番１号 イズミヤ千里丘２階レインボーランド千里丘店,1台
きゃらんど和泉,大阪府和泉市あゆみ野４－４－７ ららぽーと和泉２階,1台
スーパーセンターオークワ和泉納花店,大阪府和泉市納花町３１３ スーパーセンターオークワ和泉納花,1台
モーリーファンタジー和泉府中店,大阪府和泉市肥子町２－２－１ イオン和泉府中４階,2台
ラウンドワンららぽーと和泉店,大阪府和泉市あゆみ野４－４－７ ４階 ららぽーと和泉,2台
レインボーランド和泉中央店,大阪府和泉市いぶき野５丁目１番１１号 エコール和泉３階,1台
モーリーファンタジー四條畷店,大阪府四條畷市砂４丁目３番２号 イオン四條畷３Ｆ,2台
楽市楽座イオンモール四條畷店,大阪府四條畷市砂４－３－２ イオン四條畷３階,1台
にこぱ原山台店,大阪府堺市南区原山台５－９－８ クロスモール,1台
ぷれいらんど３７３泉ヶ丘店,大阪府堺市南区三原台１―１―３ ジョイパーク泉ヶ丘１階,1台
イトーヨーカドー　アリオ内鳳店,大阪府堺市西区鳳南町３－１９９－１２ アリオ鳳,2台
イトーヨーカドー津久野店,大阪府堺市西区下田町２０－１ イトーヨーカドー津久野,1台
ゲームパニック堺,大阪府堺市堺区築港八幡町1番地1 堺浜シーサイドステージ内堺浜えんため館,2台
ソユーゲームフィールド堺鉄砲町店,大阪府堺市堺区鉄砲町1番地 イオンモール堺鉄砲町3階,1台
トイザらス堺店,大阪府堺市北区長曽根町１９２１ トイザらス堺,1台
ナムコランド鳳,大阪府堺市西区鳳南町３－１９９－１２ アリオ鳳３Ｆ　３２８０,3台
ハローズガーデン津久野店,大阪府堺市西区下田町２０－１ イトーヨーカドー津久野２Ｆ,1台
ハローズガーデン鳳店,大阪府堺市西区鳳南町３－１９９－１２ アリオ鳳３Ｆ,1台
モーリーファンタジーおおとり店,大阪府堺市西区鳳東町７－７３３ おおとりウィングス２階,1台
モーリーファンタジー堺北花田店,大阪府堺市北区東浅香山町４－１－１２ イオン堺北花田２階,3台
モーリーファンタジー堺鉄砲町店,大阪府堺市堺区鉄砲町1 イオンスタイル堺鉄砲町3階,1台
モーリーファンタジー新金岡店,大阪府堺市北区新金岡町４－１－１１ イオン新金岡３階,1台
ラウンドワンスタジアム堺中央環状店,大阪府堺市東区石原町２町２４１番 ラウンドワンスタジアム堺中央環状,1台
レインボーランド泉北店,大阪府堺市中区小阪２７０ イズミヤ泉北２階,1台
タイトーFステーション住道店,大阪府大東市赤井１－４－３ ポップタウン住道３Ｆ,1台
MEGAドン・キホーテ深江橋店,大阪府大阪市東成区深江北１－１３ ＭＥＧＡドン・キホーテ深江橋,1台
NICOPAベルファ都島店,大阪府大阪市都島区友渕２－１３－３４ ベルファ都島３Ｆ,1台
PALO京橋店,大阪府大阪市都島区片町2-3-51 イオン京橋2・3階,2台
namcoなんばパークス店,大阪府大阪市浪速区難波中2丁目10番70号 なんばパークス6F,1台
namcoイオンモール鶴見緑地店,大阪府大阪市鶴見区鶴見４－１７－１－４２１ イオンモール鶴見４Ｆ,2台
namco大阪日本橋店,大阪府大阪市浪速区難波中2-1-17 コスモビル,4台
namco梅田,大阪府大阪市北区小松原町３番３号 ＯＳビル２Ｆナムコシティ内,4台
あべのハルカス近鉄本店(ナムコゲームコーナー),大阪府大阪市阿倍野区阿倍野筋1-1-43 あべのハルカス近鉄本店ウイング館2階,1台
かみしんプラザアミューズパーク,大阪府大阪市東淀川区大隅1-6-12,1台
イトーヨーカドーあべの店,大阪府大阪市阿倍野区阿倍野筋１－６－１ あべのキューズタウン,2台
キャラポップストアあべのHOOP,大阪府大阪市阿倍野区阿倍野筋1-2-30,4台
セガあべのキューズモール,大阪府大阪市阿倍野区阿倍野筋１－６－１ あべのキューズタウン,2台
セガワールドアポロ,大阪府大阪市阿倍野区阿倍野筋１－５－３１ アポロビル３Ｆ,2台
セガ今福,大阪府大阪市城東区今福東１－９－３４ セガ今福,1台
タイトーステーション大阪日本橋店,大阪府大阪市浪速区日本橋４－９－１４ タイトーステーション大阪日本橋,1台
タイトーステーション梅三小路,大阪府大阪市北区梅田3丁目2-4,1台
タイトーステーション難波,大阪府大阪市中央区難波千日前１５－１２ タイトーステーション難波,1台
トイザらス住之江公園店,大阪府大阪市住之江区南加賀屋２－３－２３ トイザらス住之江公園,2台
ドン・キホーテ新世界店,大阪府大阪市浪速区恵美須東３－４－３６ ＭＥＧＡドン・キホーテ新世界,1台
ビックカメラなんば店,大阪府大阪市中央区千日前２－１０－１ ビックカメラなんば,2台
モーリーファンタジー京橋店,大阪府大阪市都島区片町2-3-51 イオン京橋4階,2台
モーリーファンタジー喜連瓜破駅前店,大阪府大阪市平野区瓜破２－１－１３ イオン喜連瓜破駅前３階,3台
モーリーファンタジー大阪ドームシティ店,大阪府大阪市西区千代崎３丁目１３番１ イオン大阪ドームシティ３階,4台
モーリーファンタジー野田阪神店,大阪府大阪市福島区海老江１－１－２３ イオン野田阪神４階,3台
モーリーファンタジー長吉店,大阪府大阪市平野区長吉長原西1-1-10 ダイエー長吉,2台
モーリーファンタジー鶴見緑地店,大阪府大阪市鶴見区鶴見4丁目17-1 イオンモール鶴見3階,3台
ヤマダ電機LABI1なんば,大阪府大阪市浪速区難波中2-11-35 ヤマダ電機LABI1なんば,2台
ヨドバシカメラマルチメディア梅田,大阪府大阪市北区大深町１－１ ヨドバシカメラマルチメディア梅田,4台
ラウンドワン千日前店,大阪府大阪市中央区難波１丁目３番１号 ラウンドワン千日前,1台
天王寺パスカ店,大阪府大阪市阿倍野区阿倍野筋２－４－５１ 天王寺パスカ,1台
楽市楽座イオンモール大阪ドーム店,大阪府大阪市西区千代崎３－１３－１ イオン大阪ドームシティ４階,1台
近鉄百貨店上本町店7F For kids'+b byこぐま,大阪府大阪市天王寺区上本町6-1-55,1台
ｎａｍｃｏ マグスミノエ店,大阪府大阪市住之江区泉１丁目１番８２号 マグスミノエ１Ｆ,1台
宝島 日根野店,大阪府大阪府泉佐野市日根野2496-1,1台
モーリーファンタジー金剛店,大阪府大阪狭山市半田1-35-1 イオン金剛,2台
namcoイオンモール大日店,大阪府守口市大日東町1番18号 イオン大日4階,2台
モーリーファンタジー大日店,大阪府守口市大日東町１－１８ イオン大日,4台
モーリーファンタジー金剛東店,大阪府富田林市向陽台３－１－１ イオン金剛東４階,2台
YAZ寝屋川店,大阪府寝屋川市石津中町25-30 YAZ寝屋川,1台
セガビバモール寝屋川,大阪府寝屋川市寝屋南２－２２－２ ビバモール寝屋川モール,1台
ユーイング 香里園店,大阪府寝屋川市日新町５－５ アル・プラザ香里園,2台
平和堂アル・プラザ香里園,大阪府寝屋川市日新町５－５ アル・プラザ香里園,1台
ぷれいらんど３７３岸和田店,大阪府岸和田市春木若松町２１－１ ラパーク岸和田２階,1台
アミュージアム岸和田店,大阪府岸和田市下松町１－３－１ ウィンディ岸和田内,1台
モーリーファンタジー東岸和田店,大阪府岸和田市土生町２－３２－７ イオン東岸和田２階,2台
ふぇすたらんど東大阪店,大阪府東大阪市西岩田３－２－３ 山陽マルナカ東大阪２Ｆ,1台
わいわいランド東大阪店,大阪府東大阪市吉田下島１－１ イトーヨーカドー東大阪２階,1台
イトーヨーカドー東大阪店,大阪府東大阪市吉田下島１－１ イトーヨーカドー東大阪,1台
セガワールド布施,大阪府東大阪市長堂１－１－１ ロンモール布施,2台
モーリーファンタジー東大阪店,大阪府東大阪市荒本北２丁目３番２２号 イオン東大阪１階,1台
モーリーファンタジー鴻池店,大阪府東大阪市鴻池町１－１－７２ 鴻池イオン２階,1台
レインボーランド若江岩田店,大阪府東大阪市瓜生堂１丁目１０番５２号 イズミヤ若江岩田４階,1台
ＡＧスクエア東大阪店,大阪府東大阪市稲田新町３－９－６４ フレスポ東大阪,1台
namcoくずはモール店,大阪府枚方市楠葉花園町１０―８５ くずはモール２Ｆ,2台
セガニトリモール枚方店,大阪府枚方市北山一丁目2番1号,2台
セガワールド枚方,大阪府枚方市須山町８３－１ サンシャインプラザ枚方,1台
モーリーファンタジー枚方店,大阪府枚方市岡本町７番１－２０３ イオン枚方４階,2台
ユーイング アル・プラザ枚方,大阪府枚方市津田元町１－４－１ アル・プラザ枚方,2台
平和堂アル・プラザ枚方,大阪府枚方市津田元町１－４－１ アル・プラザ枚方,1台
モーリーファンタジー池田駅前店,大阪府池田市満寿美町2-2 ダイエー池田駅前4F,1台
namcoりんくうシークル店,大阪府泉佐野市りんくう往来南３ りんくうタウン,1台
ハローズガーデン泉佐野店,大阪府泉佐野市下瓦屋２－２－７７ ショッパーズモール泉佐野３階,1台
ソユーゲームフィールド泉南店,大阪府泉南市りんくう南浜3-12 イオンモールりんくう泉南2階,1台
モーリーファンタジーりんくう泉南店,大阪府泉南市りんくう南浜３－１２ イオンモールりんくう泉南２階,3台
泉大津フタバボウル,大阪府泉大津市松之浜町１丁目２番５３号 泉大津フタバボウル,1台
NAMCOLANDみのおキューズモール,大阪府箕面市西宿１－１７－２２ みのおキューズモール３階,1台
イオン新茨木店,大阪府茨木市中津町１８－１ イオン新茨木,1台
モーリーファンタジー・f茨木店,大阪府茨木市松ヶ本町８－３０－５ イオン茨木４階,2台
モーリーファンタジー茨木店,大阪府茨木市松ヶ本町８－３０－３ イオン茨木,3台
ユーイング 茨木店,大阪府茨木市上郡２－１２－８ アル・プラザ茨木,1台
平和堂アル・プラザ茨木,大阪府茨木市上郡２－１２－８ アル・プラザ茨木,1台
トイザらス藤井寺店,大阪府藤井寺市岡２－８－４１ ソリヤ２Ｆ,1台
ＣＬＵＢＳＥＧＡ藤井寺,大阪府藤井寺市沢田１丁目２０－８ ＣＬＵＢＳＥＧＡ藤井寺,1台
セガ 新三国アルゴ7店,大阪府豊中市神州町１－１５ セガ新三国アルゴ７,1台
モーリーファンタジー曽根店,大阪府豊中市曽根東町3-3-1 ダイエー曽根,1台
チャイルズ　貝塚店,大阪府貝塚市小瀬９１－１ ユニチカオークタウン貝塚,1台
モーリーファンタジー貝塚店,大阪府貝塚市地蔵堂７４－２ イオン貝塚,1台
モーリーファンタジー古川橋駅前店,大阪府門真市末広町４１－２ ダイエー古川橋駅前,2台
モーリーファンタジー摂津富田店,大阪府高槻市大畑町13-1 ダイエー摂津富田2F,2台
モーリーファンタジー高槻店,大阪府高槻市萩之庄３－４７－２ イオン高槻３階,3台
ラウンドワンスタジアム高槻店,大阪府高槻市辻子３丁目６番４号 ラウンドワンスタジアム高槻,1台
平和堂アル・プラザ高槻,大阪府高槻市芥川町１－２C－２０１ アクトアモーレ,1台
